{
  "@context": [
    "https://www.w3.org/2018/credentials/v1",
    "http://localhost:8443/docs/vc.bmsProduction.schema.html"
  ],
  "id": "urn:uuid:982c43ee-3d16-419a-a2f4-5c61710f428b",
  "type": [
    "VerifiableCredential",
    "BMSProduction"
  ],
  "issuer": "did:batterypass:bms.test",
  "holder": "did:batterypass:oem.VW",
  "issuanceDate": "2025-06-10T12:01:00Z",
  "expirationDate": "2026-06-10T12:01:00Z",
  "credentialSubject": {
    "id": "did:batterypass:oem.VW",
    "type": "BMSProduction",
    "bmsDid": "did:batterypass:bms.test",
    "timestamp": "2025-06-10",
    "lotNumber": "LOT-775533"
  },
  "proof": {
    "type": "EcdsaSecp256r1Signature2019",
    "created": "2025-06-10T12:01:03Z",
    "verificationMethod": "did:batterypass:oem.VW#key-1",
    "proofPurpose": "authentication",
    "jws": "eyJhbGciOiJSUzI1NiIsInR5cCI6IkpXVCJ9.eyJAY29udGV4dCI6WyJodHRwczovL3d3dy53My5vcmcvMjAxOC9jcmVkZW50aWFscy92MSIsImh0dHA6Ly9sb2NhbGhvc3Q6ODQ0My9kb2NzL3ZjLmJtc1Byb2R1Y3Rpb24uc2NoZW1hLmh0bWwiXSwiaWQiOiJ1cm46dXVpZDo5ODJjNDNlZS0zZDE2LTQxOWEtYTJmNC01YzYxNzEwZjQyOGIiLCJ0eXBlIjpbIlZlcmlmaWFibGVDcmVkZW50aWFsIiwiQk1TUHJvZHVjdGlvbiJdLCJpc3N1ZXIiOiJkaWQ6YmF0dGVyeXBhc3M6Ym1zLnRlc3QiLCJob2xkZXIiOiJkaWQ6YmF0dGVyeXBhc3M6b2VtLlZXIiwiaXNzdWFuY2VEYXRlIjoiMjAyNS0wNi0xMFQxMjowMTowMFoiLCJleHBpcmF0aW9uRGF0ZSI6IjIwMjYtMDYtMTBUMTI6MDE6MDBaIiwiY3JlZGVudGlhbFN1YmplY3QiOnsiaWQiOiJkaWQ6YmF0dGVyeXBhc3M6b2VtLlZXIiwidHlwZSI6IkJNU1Byb2R1Y3Rpb24iLCJibXNEaWQiOiJkaWQ6YmF0dGVyeXBhc3M6Ym1zLnRlc3QiLCJ0aW1lc3RhbXAiOiIyMDI1LTA2LTEwIiwibG90TnVtYmVyIjoiTE9ULTc3NTUzMyJ9LCJwcm9vZiI6eyJ0eXBlIjoiRWNkc2FTZWNwMjU2cjFTaWduYXR1cmUyMDE5IiwiY3JlYXRlZCI6IjIwMjUtMDYtMTBUMTI6MDE6MDNaIiwidmVyaWZpY2F0aW9uTWV0aG9kIjoiZGlkOmJhdHRlcnlwYXNzOm9lbS5WVyNrZXktMSIsInByb29mUHVycG9zZSI6ImF1dGhlbnRpY2F0aW9uIiwiandzIjoiIn19.Y0_Rv4kr2CiVWLaotOkMUs5b7Lop5pGfGufEyyyWbKtmLpviFBqrOLFBj2IiYF0wykpsAcZTDG94xc82WCgOptAZ2FN4oFUuy82xuZbjzHgfqNUXBpvis9FDLI1MvaVPC7X9uux31LXjh70RPkUciJSW18eQkkvyDnJZitD-F6xSo1913Dvzj9XeIW5kJiagrHIrnuHIflfubdbvBqNsrZlueWwSvSbEzqgEx18hEilbuVOlOtKMERNMENNPguMigLplSl8rnNdIHFNHboCXIkt2u3RHepaeUHw86U-GhLnC6ExNazyMgf5-Wsr1jRwtmPLgoZEcQmLk1ickT2ywlw"
  }
}